{
  "specVersion": "0.1.0",
  "id": "urn:srcos:agent-machine:signed-release-bundle-envelope:bootstrap-unsigned",
  "kind": "SignedReleaseBundleEnvelope",
  "subject": {
    "subjectKind": "ReleaseEvidenceBundle",
    "subjectRef": "examples/release-evidence-bundle.bootstrap.json",
    "subjectDigest": "sha256:aaaaaaaaaaaaaaaaaaaaaaaaaaaaaaaaaaaaaaaaaaaaaaaaaaaaaaaaaaaaaaaa",
    "sourceCommitSha": "2f905e63818cbefe823977946ba24bce801c7fa2",
    "workflowRunId": 25335379781
  },
  "signature": {
    "status": "unsigned",
    "algorithm": null,
    "keyRef": null,
    "signatureDigest": null,
    "signatureRef": null,
    "transparencyLogRef": null,
    "certificateRef": null
  },
  "verification": {
    "verified": false,
    "verificationStatus": "not-run",
    "verifiedAt": null,
    "verifierVersion": null,
    "failureReason": "bootstrap envelope is intentionally unsigned"
  },
  "receiptSafety": {
    "includeRawContent": false,
    "rawPromptContentIncluded": false,
    "rawKvCacheContentIncluded": false,
    "secretValuesIncluded": false,
    "privateMemoryIncluded": false
  },
  "generatedAt": "2026-05-04T18:20:00Z",
  "notes": [
    "Unsigned bootstrap envelope only.",
    "Production release bundles require real signature verification."
  ]
}
